### ISSUE TITLE
Fresh install on Debian 10 client config drops network connectivity

### ISSUE THREAD

**Issue by chrissound** [angristan/wireguard-install#196]
I have documented my issues here: https://unix.stackexchange.com/questions/634453/wireguard-wg0-packet-has-unallowed-src-ip

One fix I had to do was add the public IP to the `Client` config on the server - maybe this is an incorrect fix though.

Essentially once running the client config, I loose network connectivity.

Here are some packet log dumps from the client:
```
80 30.827763166 87.246.7.226 <E2><86><92> 192.248.154.136 TCP 76 [TCP Retransmission] 57034 <E2><86><92> 25 [SYN] Seq=0 Win=29200 Len=0 MSS=1460 SACK_PERM=1 TSval=342868104 TSecr=0 WS=128
   81 30.827859690 192.248.154.136 <E2><86><92> 87.246.7.226 TCP 56 25 <E2><86><92> 57034 [RST, ACK] Seq=1 Ack=1 Win=0 Len=0
   82 33.439281276 192.248.154.136 <E2><86><92> 192.248.152.91 UDP 192 59054 <E2><86><92> 58338 Len=148
   83 36.811164287 192.248.154.136 <E2><86><92> 108.61.73.244 NTP 92 NTP Version 4, client
   84 38.146118476 87.246.7.243 <E2><86><92> 192.248.154.136 TCP 76 6076 <E2><86><92> 25 [SYN] Seq=0 Win=29200 Len=0 MSS=1460 SACK_PERM=1 TSval=211747651 TSecr=0 WS=1024
   85 38.146182173 192.248.154.136 <E2><86><92> 87.246.7.243 TCP 56 25 <E2><86><92> 6076 [RST, ACK] Seq=1 Ack=1 Win=0 Len=0
   86 38.559280480 192.248.154.136 <E2><86><92> 192.248.152.91 UDP 192 59054 <E2><86><92> 58338 Len=148
   87 38.852121979 87.246.7.226 <E2><86><92> 192.248.154.136 TCP 76 [TCP Retransmission] 57034 <E2><86><92> 25 [SYN] Seq=0 Win=29200 Len=0 MSS=1460 SACK_PERM=1 TSval=342876128 TSecr=0 WS=128
   88 38.852220458 192.248.154.136 <E2><86><92> 87.246.7.226 TCP 56 25 <E2><86><92> 57034 [RST, ACK] Seq=1 Ack=1 Win=0 Len=0
   89 39.146306580 87.246.7.243 <E2><86><92> 192.248.154.136 TCP 76 [TCP Retransmission] 6076 <E2><86><92> 25 [SYN] Seq=0 Win=29200 Len=0 MSS=1460 SACK_PERM=1 TSval=211748652 TSecr=0 WS=1024
   90 39.146388276 192.248.154.136 <E2><86><92> 87.246.7.243 TCP 56 25 <E2><86><92> 6076 [RST, ACK] Seq=1 Ack=1 Win=0 Len=0
   91 41.150763667 87.246.7.243 <E2><86><92> 192.248.154.136 TCP 76 [TCP Retransmission] 6076 <E2><86><92> 25 [SYN] Seq=0 Win=29200 Len=0 MSS=1460 SACK_PERM=1 TSval=211750656 TSecr=0 WS=1024
   92 41.150880444 192.248.154.136 <E2><86><92> 87.246.7.243 TCP 56 25 <E2><86><92> 6076 [RST, ACK] Seq=1 Ack=1 Win=0 Len=0
   93 41.630158997 212.70.149.54 <E2><86><92> 192.248.154.136 TCP 76 46658 <E2><86><92> 25 [SYN] Seq=0 Win=29200 Len=0 MSS=1460 SACK_PERM=1 TSval=42893859 TSecr=0 WS=1024
   94 41.630236617 192.248.154.136 <E2><86><92> 212.70.149.54 TCP 56 25 <E2><86><92> 46658 [RST, ACK] Seq=1 Ack=1 Win=0 Len=0
   95 41.811177910 192.248.154.136 <E2><86><92> 108.61.73.243 NTP 92 NTP Version 4, client
   96 42.630885040 212.70.149.54 <E2><86><92> 192.248.154.136 TCP 76 [TCP Retransmission] 46658 <E2><86><92> 25 [SYN] Seq=0 Win=29200 Len=0 MSS=1460 SACK_PERM=1 TSval=42894860 TSecr=0 WS=1024
   97 42.630953128 192.248.154.136 <E2><86><92> 212.70.149.54 TCP 56 25 <E2><86><92> 46658 [RST, ACK] Seq=1 Ack=1 Win=0 Len=0
   98 43.353963530 fe:00:03:35:d7:65 <E2><86><92>              ARP 44 Who has 192.248.154.136? Tell 104.238.168.72
   99 43.354021247 56:00:03:35:d7:65 <E2><86><92>              ARP 44 192.248.154.136 is at 56:00:03:35:d7:65
  100 43.679313102 192.248.154.136 <E2><86><92> 192.248.152.91 UDP 192 59054 <E2><86><92> 58338 Len=148
  101 44.634917692 212.70.149.54 <E2><86><92> 192.248.154.136 TCP 76 [TCP Retransmission] 46658 <E2><86><92> 25 [SYN] Seq=0 Win=29200 Len
  ```

**Comment by chrissound** [comment]
Nevermind... It works, I just assumed the public IP would still be accessible afterwards. But it seems not. :)
